{
  "schema_version": 1,
  "diagram_type": "lifecycle",
  "meta": {
    "title": "Agent Run Lifecycle",
    "output": "examples/lifecycle-agent-run.html",
    "viewBox": [1030, 630],
    "animation": "trace",
    "quality_profile": "showcase"
  },
  "lanes": [
    { "id": "main", "label": "Lifecycle phases" },
    { "id": "waiting", "label": "Interruptions" },
    { "id": "exceptions", "label": "Recovery loop" },
    { "id": "terminal", "label": "Terminal exits" }
  ],
  "states": [
    { "id": "queued", "type": "start", "label": "Queued", "sublabel": "request accepted", "lane": "main", "col": 0, "step": "01", "tag": "entry" },
    { "id": "planning", "type": "active", "label": "Planning", "sublabel": "build task graph", "lane": "main", "col": 1, "step": "02", "tag": "model" },
    { "id": "executing", "type": "active", "label": "Executing", "sublabel": "tool calls", "lane": "main", "col": 2, "step": "03", "tag": "work" },
    { "id": "reviewing", "type": "decision", "label": "Reviewing", "sublabel": "quality gate", "lane": "main", "col": 3, "step": "04", "tag": "check" },
    { "id": "completed", "type": "success", "label": "Completed", "sublabel": "final response", "lane": "main", "col": 4, "step": "05", "tag": "done" },
    { "id": "approval", "type": "waiting", "label": "Needs Approval", "sublabel": "human gate", "lane": "waiting", "col": 0, "tag": "pause" },
    { "id": "blocked", "type": "waiting", "label": "Blocked", "sublabel": "missing input", "lane": "waiting", "col": 1, "tag": "wait" },
    { "id": "failed", "type": "failure", "label": "Failed", "sublabel": "recoverable error", "lane": "exceptions", "col": 0, "yOffset": 78, "tag": "retryable" },
    { "id": "cancelled", "type": "failure", "label": "Cancelled", "sublabel": "user stopped", "lane": "terminal", "col": 0, "tag": "terminal" },
    { "id": "expired", "type": "failure", "label": "Expired", "sublabel": "timeout", "lane": "terminal", "col": 1, "tag": "terminal" }
  ],
  "transitions": [
    { "id": "approval-needed", "from": "executing", "to": "approval", "variant": "decision", "fromSide": "bottom", "toSide": "top", "route": "straight" },
    { "id": "review-blocked", "from": "reviewing", "to": "blocked", "variant": "default", "route": "drop" },
    { "id": "execution-failed", "from": "executing", "to": "failed", "variant": "decision", "fromSide": "left", "toSide": "left", "via": [[320, 157], [320, 385]] },
    { "id": "failed-retry", "from": "failed", "to": "executing", "variant": "emphasis", "fromSide": "left", "toSide": "top", "via": [[20, 385], [20, 80], [402, 80]] },
    { "id": "block-expired", "from": "blocked", "to": "expired", "variant": "decision", "fromSide": "bottom", "toSide": "top", "route": "straight" },
    { "id": "approval-cancelled", "from": "approval", "to": "cancelled", "variant": "decision", "fromSide": "bottom", "toSide": "top", "via": [[480, 336], [480, 432], [402, 432]] }
  ],
  "cards": [
    {
      "dot": "emerald",
      "title": "Main Path + Waits",
      "items": [
        "The run has five ordered phases from queue to completion",
        "Approval and missing input pause the run without ending it"
      ]
    },
    {
      "dot": "rose",
      "title": "Recovery + Terminal Exits",
      "items": [
        "Failed loops back while retry budget remains",
        "Cancelled and Expired are terminal exits with no return path"
      ]
    }
  ]
}
